{
  "$schema": "http://json-schema.org/draft-07/schema#",
  "title": "Terraform Ansible Inventory",
  "description": "Schema for the terraform_inventory.json output consumed by ansible-proxmox-apps",
  "type": "object",
  "required": ["containers", "docker_vms", "splunk_vm", "constants"],
  "additionalProperties": false,
  "properties": {
    "containers": {
      "type": "object",
      "description": "LXC containers managed by Terraform",
      "additionalProperties": {
        "$ref": "#/definitions/container_entry"
      }
    },
    "vms": {
      "type": "object",
      "description": "Regular VMs managed by Terraform (may be empty)",
      "additionalProperties": {
        "$ref": "#/definitions/vm_entry"
      }
    },
    "docker_vms": {
      "type": "object",
      "description": "VMs with the docker tag — subset of vms",
      "additionalProperties": {
        "$ref": "#/definitions/vm_entry"
      }
    },
    "splunk_vm": {
      "type": "object",
      "description": "Splunk VM entry, keyed by name",
      "additionalProperties": {
        "$ref": "#/definitions/splunk_entry"
      },
      "minProperties": 1
    },
    "constants": {
      "$ref": "#/definitions/constants"
    }
  },
  "definitions": {
    "container_entry": {
      "type": "object",
      "required": ["vmid", "ip", "hostname", "ansible_connection", "tags", "node", "ansible_pct_vmid"],
      "additionalProperties": false,
      "properties": {
        "vmid": {
          "type": "integer",
          "minimum": 100
        },
        "ip": {
          "type": "string",
          "pattern": "^\\d{1,3}\\.\\d{1,3}\\.\\d{1,3}\\.\\d{1,3}$"
        },
        "hostname": {
          "type": "string",
          "minLength": 1
        },
        "ansible_connection": {
          "type": "string",
          "const": "community.proxmox.proxmox_pct_remote"
        },
        "ansible_pct_vmid": {
          "type": "integer",
          "minimum": 100
        },
        "tags": {
          "type": "array",
          "items": {
            "type": "string"
          }
        },
        "node": {
          "type": "string",
          "minLength": 1
        },
        "pool_id": {
          "type": "string",
          "minLength": 1
        }
      }
    },
    "vm_entry": {
      "type": "object",
      "required": ["vmid", "ip", "hostname", "ansible_connection", "tags", "node"],
      "additionalProperties": false,
      "properties": {
        "vmid": {
          "type": "integer",
          "minimum": 100
        },
        "ip": {
          "type": "string",
          "pattern": "^\\d{1,3}\\.\\d{1,3}\\.\\d{1,3}\\.\\d{1,3}$"
        },
        "hostname": {
          "type": "string",
          "minLength": 1
        },
        "ansible_connection": {
          "type": "string",
          "enum": ["ssh"]
        },
        "tags": {
          "type": "array",
          "items": {
            "type": "string"
          }
        },
        "node": {
          "type": "string",
          "minLength": 1
        },
        "pool_id": {
          "type": "string",
          "minLength": 1
        }
      }
    },
    "splunk_entry": {
      "type": "object",
      "required": ["vmid", "ip", "hostname", "ansible_connection", "node"],
      "additionalProperties": false,
      "properties": {
        "vmid": {
          "type": "integer",
          "minimum": 100
        },
        "ip": {
          "type": "string",
          "pattern": "^\\d{1,3}\\.\\d{1,3}\\.\\d{1,3}\\.\\d{1,3}$"
        },
        "hostname": {
          "type": "string",
          "minLength": 1
        },
        "ansible_connection": {
          "type": "string",
          "enum": ["ssh"]
        },
        "node": {
          "type": "string",
          "minLength": 1
        }
      }
    },
    "constants": {
      "type": "object",
      "required": ["service_ports", "syslog_ports", "netflow_ports", "notification_ports"],
      "additionalProperties": false,
      "properties": {
        "service_ports": {
          "type": "object",
          "required": ["haproxy_stats", "splunk_web", "splunk_hec", "splunk_mgmt", "cribl_edge_api", "cribl_stream_api"],
          "additionalProperties": {
            "type": "integer",
            "minimum": 1,
            "maximum": 65535
          },
          "properties": {
            "haproxy_stats": {"type": "integer"},
            "splunk_web": {"type": "integer"},
            "splunk_hec": {"type": "integer"},
            "splunk_mgmt": {"type": "integer"},
            "cribl_edge_api": {"type": "integer"},
            "cribl_stream_api": {"type": "integer"}
          }
        },
        "syslog_ports": {
          "type": "object",
          "required": ["unifi", "palo_alto", "cisco_asa", "linux", "windows"],
          "additionalProperties": {
            "type": "integer",
            "minimum": 1,
            "maximum": 65535
          },
          "properties": {
            "unifi": {"type": "integer"},
            "palo_alto": {"type": "integer"},
            "cisco_asa": {"type": "integer"},
            "linux": {"type": "integer"},
            "windows": {"type": "integer"}
          }
        },
        "netflow_ports": {
          "type": "object",
          "required": ["unifi"],
          "additionalProperties": {
            "type": "integer",
            "minimum": 1,
            "maximum": 65535
          },
          "properties": {
            "unifi": {"type": "integer"}
          }
        },
        "notification_ports": {
          "type": "object",
          "required": ["mailpit_smtp", "mailpit_web", "ntfy_http"],
          "additionalProperties": {
            "type": "integer",
            "minimum": 1,
            "maximum": 65535
          },
          "properties": {
            "mailpit_smtp": {"type": "integer"},
            "mailpit_web": {"type": "integer"},
            "ntfy_http": {"type": "integer"}
          }
        }
      }
    }
  }
}
